<?xml version="1.0" encoding="UTF-8"?>
<!-- edited with XMLSpy v2017 rel. 3 sp1 (x64) (http://www.altova.com) by ï»¿Skatteetaten (Skatteetaten) -->
<xs:schema xmlns:xs="http://www.w3.org/2001/XMLSchema" xmlns:vc="http://www.w3.org/2007/XMLSchema-versioning" elementFormDefault="qualified" attributeFormDefault="unqualified" vc:minVersion="1.1">
	<xs:element name="GroupingCategoryCode">
		<xs:annotation>
			<xs:documentation>General Ledger Grouping Categories and Codes for mapping in Norwegian SAF-T Financial.</xs:documentation>
		</xs:annotation>
		<xs:complexType>
			<xs:sequence>
				<xs:element name="Account" maxOccurs="unbounded">
					<xs:annotation>
						<xs:documentation>GL Accounts</xs:documentation>
					</xs:annotation>
					<xs:complexType>
						<xs:sequence>
							<xs:element name="GroupingCategory">
								<xs:annotation>
									<xs:documentation>Type of category. </xs:documentation>
								</xs:annotation>
								<xs:simpleType>
									<xs:restriction base="xs:string">
										<xs:minLength value="2"/>
										<xs:maxLength value="200"/>
									</xs:restriction>
								</xs:simpleType>
							</xs:element>
							<xs:element name="CategoryDescription" maxOccurs="unbounded">
								<xs:annotation>
									<xs:documentation>Descripton of the category.</xs:documentation>
								</xs:annotation>
								<xs:complexType>
									<xs:simpleContent>
										<xs:extension base="xs:string">
											<xs:attribute name="ISOLanguageCode">
												<xs:annotation>
													<xs:documentation>Three-letter language code according to ISO 639-3 standared. Example: NOB for Norwegian.</xs:documentation>
												</xs:annotation>
												<xs:simpleType>
													<xs:restriction base="xs:string">
														<xs:length value="3"/>
													</xs:restriction>
												</xs:simpleType>
											</xs:attribute>
										</xs:extension>
									</xs:simpleContent>
								</xs:complexType>
							</xs:element>
							<xs:element name="GroupingCode">
								<xs:annotation>
									<xs:documentation>Code for the type of category.</xs:documentation>
								</xs:annotation>
							</xs:element>
							<xs:element name="CodeDescription" maxOccurs="unbounded">
								<xs:annotation>
									<xs:documentation>Descripton of the code.</xs:documentation>
								</xs:annotation>
								<xs:complexType>
									<xs:simpleContent>
										<xs:extension base="xs:string">
											<xs:attribute name="ISOLanguageCode">
												<xs:annotation>
													<xs:documentation>Three-letter language code according to ISO 639-3 standared. Example: NOB for Norwegian.</xs:documentation>
												</xs:annotation>
												<xs:simpleType>
													<xs:restriction base="xs:string">
														<xs:length value="3"/>
													</xs:restriction>
												</xs:simpleType>
											</xs:attribute>
										</xs:extension>
									</xs:simpleContent>
								</xs:complexType>
							</xs:element>
						</xs:sequence>
					</xs:complexType>
				</xs:element>
			</xs:sequence>
		</xs:complexType>
	</xs:element>
</xs:schema>