<?xml version="1.0" encoding="UTF-8"?>
<GroupingCategoryCode xmlns:xsi="http://www.w3.org/2001/XMLSchema-instance" xsi:noNamespaceSchemaLocation="Grouping_Category_Code.xsd">
	<Account>
		<GroupingCategory>KA_KS</GroupingCategory>
		<CategoryDescription ISOLanguageCode="NOB">KOSTRA Arts_KS</CategoryDescription>
		<GroupingCode>010</GroupingCode>
		<CodeDescription ISOLanguageCode="NOB">Fastlønn</CodeDescription>
	</Account>
	<Account>
		<GroupingCategory>KA_KS</GroupingCategory>
		<CategoryDescription ISOLanguageCode="NOB">KOSTRA Arts_KS</CategoryDescription>
		<GroupingCode>020</GroupingCode>
		<CodeDescription ISOLanguageCode="NOB">lønn til vikarer</CodeDescription>
	</Account>
	<Account>
		<GroupingCategory>KA_KS</GroupingCategory>
		<CategoryDescription ISOLanguageCode="NOB">KOSTRA Arts_KS</CategoryDescription>
		<GroupingCode>030</GroupingCode>
		<CodeDescription ISOLanguageCode="NOB">lønn til ekstrahjelp</CodeDescription>
	</Account>
	<Account>
		<GroupingCategory>KA_KS</GroupingCategory>
		<CategoryDescription ISOLanguageCode="NOB">KOSTRA Arts_KS</CategoryDescription>
		<GroupingCode>040</GroupingCode>
		<CodeDescription ISOLanguageCode="NOB">Overtidslønn</CodeDescription>
	</Account>
	<Account>
		<GroupingCategory>KA_KS</GroupingCategory>
		<CategoryDescription ISOLanguageCode="NOB">KOSTRA Arts_KS</CategoryDescription>
		<GroupingCode>050</GroupingCode>
		<CodeDescription ISOLanguageCode="NOB">Annen lønn og trekkpliktige godtgjørelser</CodeDescription>
	</Account>
	<Account>
		<GroupingCategory>KA_KS</GroupingCategory>
		<CategoryDescription ISOLanguageCode="NOB">KOSTRA Arts_KS</CategoryDescription>
		<GroupingCode>070</GroupingCode>
		<CodeDescription ISOLanguageCode="NOB">Lønn til vedlikehold</CodeDescription>
	</Account>
	<Account>
		<GroupingCategory>KA_KS</GroupingCategory>
		<CategoryDescription ISOLanguageCode="NOB">KOSTRA Arts_KS</CategoryDescription>
		<GroupingCode>075</GroupingCode>
		<CodeDescription ISOLanguageCode="NOB">lønn til renhold</CodeDescription>
	</Account>
	<Account>
		<GroupingCategory>KA_KS</GroupingCategory>
		<CategoryDescription ISOLanguageCode="NOB">KOSTRA Arts_KS</CategoryDescription>
		<GroupingCode>080</GroupingCode>
		<CodeDescription ISOLanguageCode="NOB">Godtgjørelser til folkevalgte</CodeDescription>
	</Account>
	<Account>
		<GroupingCategory>KA_KS</GroupingCategory>
		<CategoryDescription ISOLanguageCode="NOB">KOSTRA Arts_KS</CategoryDescription>
		<GroupingCode>089</GroupingCode>
		<CodeDescription ISOLanguageCode="NOB">Trekkpliktig, opplysningspliktig, ikke arbeidsgiveravgiftspliktig lønn</CodeDescription>
	</Account>
	<Account>
		<GroupingCategory>KA_KS</GroupingCategory>
		<CategoryDescription ISOLanguageCode="NOB">KOSTRA Arts_KS</CategoryDescription>
		<GroupingCode>090</GroupingCode>
		<CodeDescription ISOLanguageCode="NOB">Pensjonsinnskudd og trekkpliktige forsikringsordninger</CodeDescription>
	</Account>
	<Account>
		<GroupingCategory>KA_KS</GroupingCategory>
		<CategoryDescription ISOLanguageCode="NOB">KOSTRA Arts_KS</CategoryDescription>
		<GroupingCode>099</GroupingCode>
		<CodeDescription ISOLanguageCode="NOB">Arbeidsgiveravgift</CodeDescription>
	</Account>
	<Account>
		<GroupingCategory>KA_KS</GroupingCategory>
		<CategoryDescription ISOLanguageCode="NOB">KOSTRA Arts_KS</CategoryDescription>
		<GroupingCode>100</GroupingCode>
		<CodeDescription ISOLanguageCode="NOB">Kontormateriell</CodeDescription>
	</Account>
	<Account>
		<GroupingCategory>KA_KS</GroupingCategory>
		<CategoryDescription ISOLanguageCode="NOB">KOSTRA Arts_KS</CategoryDescription>
		<GroupingCode>105</GroupingCode>
		<CodeDescription ISOLanguageCode="NOB">Undervisningsmateriell</CodeDescription>
	</Account>
	<Account>
		<GroupingCategory>KA_KS</GroupingCategory>
		<CategoryDescription ISOLanguageCode="NOB">KOSTRA Arts_KS</CategoryDescription>
		<GroupingCode>110</GroupingCode>
		<CodeDescription ISOLanguageCode="NOB">Medisinsk forbruksmateriell</CodeDescription>
	</Account>
	<Account>
		<GroupingCategory>KA_KS</GroupingCategory>
		<CategoryDescription ISOLanguageCode="NOB">KOSTRA Arts_KS</CategoryDescription>
		<GroupingCode>114</GroupingCode>
		<CodeDescription ISOLanguageCode="NOB">Medikamenter</CodeDescription>
	</Account>
	<Account>
		<GroupingCategory>KA_KS</GroupingCategory>
		<CategoryDescription ISOLanguageCode="NOB">KOSTRA Arts_KS</CategoryDescription>
		<GroupingCode>115</GroupingCode>
		<CodeDescription ISOLanguageCode="NOB">Matvarer</CodeDescription>
	</Account>
	<Account>
		<GroupingCategory>KA_KS</GroupingCategory>
		<CategoryDescription ISOLanguageCode="NOB">KOSTRA Arts_KS</CategoryDescription>
		<GroupingCode>120</GroupingCode>
		<CodeDescription ISOLanguageCode="NOB">Samlepost for annet forbruksmateriell, varer og tjenester</CodeDescription>
	</Account>
	<Account>
		<GroupingCategory>KA_KS</GroupingCategory>
		<CategoryDescription ISOLanguageCode="NOB">KOSTRA Arts_KS</CategoryDescription>
		<GroupingCode>130</GroupingCode>
		<CodeDescription ISOLanguageCode="NOB">Post, bank, telefon, internett, bredbånd</CodeDescription>
	</Account>
	<Account>
		<GroupingCategory>KA_KS</GroupingCategory>
		<CategoryDescription ISOLanguageCode="NOB">KOSTRA Arts_KS</CategoryDescription>
		<GroupingCode>140</GroupingCode>
		<CodeDescription ISOLanguageCode="NOB">Annonser, reklame, informasjon</CodeDescription>
	</Account>
	<Account>
		<GroupingCategory>KA_KS</GroupingCategory>
		<CategoryDescription ISOLanguageCode="NOB">KOSTRA Arts_KS</CategoryDescription>
		<GroupingCode>150</GroupingCode>
		<CodeDescription ISOLanguageCode="NOB">Opplæring og kurs</CodeDescription>
	</Account>
	<Account>
		<GroupingCategory>KA_KS</GroupingCategory>
		<CategoryDescription ISOLanguageCode="NOB">KOSTRA Arts_KS</CategoryDescription>
		<GroupingCode>160</GroupingCode>
		<CodeDescription ISOLanguageCode="NOB">Utgifter og godtgjørelser for reiser, diett, bil mv. som er opplysningspliktige</CodeDescription>
	</Account>
	<Account>
		<GroupingCategory>KA_KS</GroupingCategory>
		<CategoryDescription ISOLanguageCode="NOB">KOSTRA Arts_KS</CategoryDescription>
		<GroupingCode>165</GroupingCode>
		<CodeDescription ISOLanguageCode="NOB">Andre opplysningspliktige godtgjørelser</CodeDescription>
	</Account>
	<Account>
		<GroupingCategory>KA_KS</GroupingCategory>
		<CategoryDescription ISOLanguageCode="NOB">KOSTRA Arts_KS</CategoryDescription>
		<GroupingCode>170</GroupingCode>
		<CodeDescription ISOLanguageCode="NOB">Transport og reise</CodeDescription>
	</Account>
	<Account>
		<GroupingCategory>KA_KS</GroupingCategory>
		<CategoryDescription ISOLanguageCode="NOB">KOSTRA Arts_KS</CategoryDescription>
		<GroupingCode>180</GroupingCode>
		<CodeDescription ISOLanguageCode="NOB">Strøm </CodeDescription>
	</Account>
	<Account>
		<GroupingCategory>KA_KS</GroupingCategory>
		<CategoryDescription ISOLanguageCode="NOB">KOSTRA Arts_KS</CategoryDescription>
		<GroupingCode>181</GroupingCode>
		<CodeDescription ISOLanguageCode="NOB">Fjernvarme og fjernkjøling</CodeDescription>
	</Account>
	<Account>
		<GroupingCategory>KA_KS</GroupingCategory>
		<CategoryDescription ISOLanguageCode="NOB">KOSTRA Arts_KS</CategoryDescription>
		<GroupingCode>182</GroupingCode>
		<CodeDescription ISOLanguageCode="NOB">Fyringsolje og fyringsparafin</CodeDescription>
	</Account>
	<Account>
		<GroupingCategory>KA_KS</GroupingCategory>
		<CategoryDescription ISOLanguageCode="NOB">KOSTRA Arts_KS</CategoryDescription>
		<GroupingCode>183</GroupingCode>
		<CodeDescription ISOLanguageCode="NOB">Naturgass og andre fossile gasser</CodeDescription>
	</Account>
	<Account>
		<GroupingCategory>KA_KS</GroupingCategory>
		<CategoryDescription ISOLanguageCode="NOB">KOSTRA Arts_KS</CategoryDescription>
		<GroupingCode>184</GroupingCode>
		<CodeDescription ISOLanguageCode="NOB">Bioenergi</CodeDescription>
	</Account>
	<Account>
		<GroupingCategory>KA_KS</GroupingCategory>
		<CategoryDescription ISOLanguageCode="NOB">KOSTRA Arts_KS</CategoryDescription>
		<GroupingCode>185</GroupingCode>
		<CodeDescription ISOLanguageCode="NOB">Forsikringer, vakthold og sikring </CodeDescription>
	</Account>
	<Account>
		<GroupingCategory>KA_KS</GroupingCategory>
		<CategoryDescription ISOLanguageCode="NOB">KOSTRA Arts_KS</CategoryDescription>
		<GroupingCode>190</GroupingCode>
		<CodeDescription ISOLanguageCode="NOB">Leie av lokaler og grunn</CodeDescription>
	</Account>
	<Account>
		<GroupingCategory>KA_KS</GroupingCategory>
		<CategoryDescription ISOLanguageCode="NOB">KOSTRA Arts_KS</CategoryDescription>
		<GroupingCode>195</GroupingCode>
		<CodeDescription ISOLanguageCode="NOB">Avgifter, gebyrer, lisenser o.l.</CodeDescription>
	</Account>
	<Account>
		<GroupingCategory>KA_KS</GroupingCategory>
		<CategoryDescription ISOLanguageCode="NOB">KOSTRA Arts_KS</CategoryDescription>
		<GroupingCode>200</GroupingCode>
		<CodeDescription ISOLanguageCode="NOB">kjøp og finansiell leie av driftsmidler</CodeDescription>
	</Account>
	<Account>
		<GroupingCategory>KA_KS</GroupingCategory>
		<CategoryDescription ISOLanguageCode="NOB">KOSTRA Arts_KS</CategoryDescription>
		<GroupingCode>209</GroupingCode>
		<CodeDescription ISOLanguageCode="NOB">Medisinsk utstyr</CodeDescription>
	</Account>
	<Account>
		<GroupingCategory>KA_KS</GroupingCategory>
		<CategoryDescription ISOLanguageCode="NOB">KOSTRA Arts_KS</CategoryDescription>
		<GroupingCode>210</GroupingCode>
		<CodeDescription ISOLanguageCode="NOB">kjøp og leie av transportmidler</CodeDescription>
	</Account>
	<Account>
		<GroupingCategory>KA_KS</GroupingCategory>
		<CategoryDescription ISOLanguageCode="NOB">KOSTRA Arts_KS</CategoryDescription>
		<GroupingCode>220</GroupingCode>
		<CodeDescription ISOLanguageCode="NOB">Leie av driftsmidler</CodeDescription>
	</Account>
	<Account>
		<GroupingCategory>KA_KS</GroupingCategory>
		<CategoryDescription ISOLanguageCode="NOB">KOSTRA Arts_KS</CategoryDescription>
		<GroupingCode>230</GroupingCode>
		<CodeDescription ISOLanguageCode="NOB">Vedlikehold, påkostning, nybygg og nyanlegg</CodeDescription>